{
  "$schema": "./blocks.schema.json",
  "version": "0.1.0",
  "contract": "@ui8kit/contract v0.4 (codex manifest: ./manifest.json)",
  "fieldMaps": "xgen/runtimes/core/assets/app/fields.ts",
  "blocks": [
    {
      "id": "AboutCompany",
      "surface": "kit-block",
      "spec": "block.about",
      "source": "xgen/specs/blocks/about.json",
      "status": "done",
      "data": [
        {
          "prop": "stats",
          "collection": "stats",
          "kind": "stat",
          "record": "Stat",
          "map": "stat",
          "list": true,
          "required": [
            "id",
            "title",
            "metadata.value.value",
            "metadata.icon.value",
            "metadata.hint.value"
          ],
          "optional": []
        },
        {
          "prop": "values",
          "collection": "values",
          "kind": "value",
          "record": "Feature",
          "map": "value",
          "list": true,
          "required": [
            "id",
            "title",
            "metadata.text.value",
            "metadata.icon.value"
          ],
          "optional": []
        }
      ],
      "settings": [
        "id",
        "layout",
        "tone",
        "density",
        "landmarkLabel"
      ],
      "labels": [
        {
          "prop": "title",
          "dictionary": "company.about.title",
          "keys": []
        },
        {
          "prop": "lead",
          "dictionary": "company.about.lead",
          "keys": []
        }
      ],
      "emptyState": true,
      "emptyMode": "omit"
    },
    {
      "id": "AboutMe",
      "surface": "kit-block",
      "spec": "block.aboutme",
      "source": "xgen/specs/blocks/aboutme.json",
      "status": "done",
      "data": [
        {
          "prop": "facts",
          "collection": "profilefacts",
          "kind": "profilefact",
          "record": "Spec",
          "map": "profilefact",
          "list": true,
          "required": [
            "id",
            "title",
            "metadata.value.value"
          ],
          "optional": []
        },
        {
          "prop": "skills",
          "collection": "skills",
          "kind": "skill",
          "record": "Skill",
          "map": "skill",
          "list": true,
          "required": [
            "id",
            "title",
            "metadata.level.value"
          ],
          "optional": []
        }
      ],
      "settings": [
        "id",
        "level",
        "layout",
        "mediaSide",
        "tone",
        "landmarkLabel"
      ],
      "labels": [
        {
          "prop": "title",
          "dictionary": "company.aboutMe.title",
          "keys": []
        },
        {
          "prop": "lead",
          "dictionary": "company.aboutMe.lead",
          "keys": []
        },
        {
          "prop": "badge",
          "dictionary": "company.aboutMe.badge",
          "keys": []
        },
        {
          "prop": "labels",
          "dictionary": "company.aboutMe",
          "keys": [
            "level"
          ]
        },
        {
          "prop": "actions.cta",
          "dictionary": "company.aboutMe.cta",
          "keys": []
        },
        {
          "prop": "actions.secondary",
          "dictionary": "company.aboutMe.more",
          "keys": []
        }
      ],
      "emptyState": true,
      "emptyMode": "omit"
    },
    {
      "id": "FeatureAccordion",
      "surface": "kit-block",
      "spec": "block.accordion",
      "source": "xgen/specs/blocks/accordion.json",
      "status": "done",
      "data": [
        {
          "prop": "features",
          "collection": "features",
          "kind": "feature",
          "record": "Feature",
          "map": "feature",
          "list": true,
          "required": [
            "id",
            "title",
            "metadata.text.value",
            "metadata.icon.value"
          ],
          "optional": []
        }
      ],
      "settings": [
        "id",
        "expand",
        "media",
        "multiple",
        "tone",
        "density",
        "landmarkLabel"
      ],
      "labels": [
        {
          "prop": "title",
          "dictionary": "vibe.accordion.title",
          "keys": []
        },
        {
          "prop": "empty",
          "dictionary": "empty.features",
          "keys": []
        }
      ],
      "emptyState": true
    },
    {
      "id": "ActivityFeed",
      "surface": "kit-block",
      "spec": "block.activity",
      "source": "xgen/specs/blocks/activity.json",
      "status": "done",
      "data": [
        {
          "prop": "events",
          "collection": "activity",
          "kind": "event",
          "record": "Event",
          "map": "event",
          "list": true,
          "required": [
            "id",
            "title",
            "metadata.text.value",
            "metadata.time.value",
            "metadata.tone.value"
          ],
          "optional": []
        }
      ],
      "settings": [
        "id",
        "layout",
        "density",
        "tone",
        "landmarkLabel"
      ],
      "labels": [
        {
          "prop": "title",
          "dictionary": "dashboard.activity.title",
          "keys": []
        },
        {
          "prop": "text",
          "dictionary": "dashboard.activity.text",
          "keys": []
        },
        {
          "prop": "empty",
          "dictionary": "empty.activity",
          "keys": []
        }
      ],
      "emptyState": true
    },
    {
      "id": "AnnouncementBar",
      "surface": "kit-block",
      "spec": "block.announcement",
      "source": "xgen/specs/blocks/announcement.json",
      "status": "done",
      "data": [],
      "settings": [
        "ctaHref",
        "icon",
        "tone",
        "layout",
        "dismiss",
        "badge",
        "position",
        "landmarkLabel"
      ],
      "labels": [
        {
          "prop": "label",
          "dictionary": "promo.announcement.label",
          "keys": []
        },
        {
          "prop": "text",
          "dictionary": "promo.announcement.text",
          "keys": []
        },
        {
          "prop": "cta",
          "dictionary": "promo.announcement.cta",
          "keys": []
        },
        {
          "prop": "dismissLabel",
          "dictionary": "promo.announcement.dismiss",
          "keys": []
        },
        {
          "prop": "badgeLabel",
          "dictionary": "promo.announcement.badge",
          "keys": []
        }
      ],
      "emptyState": false
    },
    {
      "id": "ArticleBody",
      "surface": "kit-block",
      "spec": "block.article",
      "source": "xgen/specs/blocks/article.json",
      "status": "done",
      "data": [
        {
          "prop": "sections",
          "collection": "article",
          "kind": "section",
          "record": "Section",
          "map": "section",
          "list": true,
          "required": [
            "id",
            "title",
            "metadata.text.value"
          ],
          "optional": [
            "metadata.quote.value"
          ]
        }
      ],
      "settings": [
        "id",
        "layout",
        "quotes",
        "tone",
        "landmarkLabel"
      ],
      "labels": [
        {
          "prop": "title",
          "dictionary": "vibe.article.title",
          "keys": []
        },
        {
          "prop": "empty",
          "dictionary": "empty.sections",
          "keys": []
        },
        {
          "prop": "tocTitle",
          "dictionary": "vibe.article.toc",
          "keys": []
        }
      ],
      "emptyState": true
    },
    {
      "id": "AuthCard",
      "surface": "kit-block",
      "spec": "block.auth",
      "source": "xgen/specs/blocks/auth.json",
      "status": "done",
      "data": [],
      "settings": [
        "id",
        "switchHref",
        "mode",
        "layout",
        "social",
        "level",
        "landmarkLabel"
      ],
      "labels": [
        {
          "prop": "title",
          "dictionary": "auth.signin.title",
          "keys": []
        },
        {
          "prop": "text",
          "dictionary": "auth.signin.text",
          "keys": []
        },
        {
          "prop": "submit",
          "dictionary": "auth.signin.submit",
          "keys": []
        },
        {
          "prop": "switchText",
          "dictionary": "auth.signin.switchText",
          "keys": []
        },
        {
          "prop": "switchLink",
          "dictionary": "auth.signin.switchLink",
          "keys": []
        },
        {
          "prop": "labels",
          "dictionary": "auth.labels",
          "keys": [
            "name",
            "email",
            "password",
            "remember",
            "forgot",
            "terms",
            "divider",
            "passkey",
            "magic"
          ]
        }
      ],
      "emptyState": false
    },
    {
      "id": "AuthLayout",
      "surface": "kit-block",
      "spec": "block.authpage",
      "source": "xgen/specs/blocks/authpage.json",
      "status": "done",
      "data": [],
      "settings": [
        "id",
        "level",
        "layout",
        "side",
        "mode",
        "social",
        "landmarkLabel"
      ],
      "labels": [
        {
          "prop": "title",
          "dictionary": "auth.signin.title",
          "keys": []
        },
        {
          "prop": "text",
          "dictionary": "auth.signin.text",
          "keys": []
        },
        {
          "prop": "submit",
          "dictionary": "auth.signin.submit",
          "keys": []
        },
        {
          "prop": "switchTo.text",
          "dictionary": "auth.signin.switchText",
          "keys": []
        },
        {
          "prop": "switchTo.link",
          "dictionary": "auth.signin.switchLink",
          "keys": []
        },
        {
          "prop": "labels",